{
  "name": "box-shadow",
  "id": 76,
  "type": "complex",
  "default_value": "",
  "author": "liujilong",
  "version": "1.0",
  "consumption_status": "skip",
  "desc": "The `box-shadow` CSS property is used to add a shadow effect on the frame of the element.",
  "is_shorthand": false,
  "compat_data": {
    "box-shadow": {
      "__compat": {
        "lynx_path": "api/css/properties/box-shadow",
        "mdn_url": "https://developer.mozilla.org/zh-CN/docs/Web/CSS/box-shadow",
        "spec_url": [],
        "status": {
          "deprecated": false,
          "experimental": false
        },
        "support": {
          "android": {
            "notes": "The new animator supports <code>box-shadow</code> keyframe and transition animations since Lynx 4.2.",
            "version_added": "1.0"
          },
          "ios": {
            "notes": "The new animator supports <code>box-shadow</code> keyframe and transition animations since Lynx 4.2.",
            "version_added": "1.0"
          },
          "harmony": {
            "notes": "The new animator supports <code>box-shadow</code> keyframe and transition animations since Lynx 4.2.",
            "version_added": "3.4"
          },
          "clay_android": {
            "version_added": "1.0"
          },
          "clay_ios": {
            "version_added": "1.0"
          },
          "clay_macos": {
            "version_added": "1.0"
          },
          "clay_windows": {
            "version_added": "1.0"
          },
          "web_lynx": {
            "version_added": true
          }
        }
      }
    }
  }
}
