{
  "name": "transition-property",
  "id": 110,
  "type": "animation-property",
  "default_value": "",
  "version": "1.0",
  "author": "liyanbo,linxiaosong",
  "consumption_status": "skip",
  "keywords": [
    "none",
    "opacity",
    "scaleX",
    "scaleY",
    "scaleXY",
    "width",
    "height",
    "background-color",
    "visibility",
    "left",
    "top",
    "right",
    "bottom",
    "transform",
    "box-shadow",
    "border-radius",
    "border-top-left-radius",
    "border-top-right-radius",
    "border-bottom-right-radius",
    "border-bottom-left-radius",
    "all"
  ],
  "desc": "The transition-property CSS property sets the CSS properties to which a transition effect should be applied.",
  "is_shorthand": false,
  "compat_data": {
    "transition-property": {
      "__compat": {
        "lynx_path": "api/css/properties/transition-property",
        "mdn_url": "https://developer.mozilla.org/zh-CN/docs/Web/CSS/transition-property",
        "spec_url": [],
        "status": {
          "deprecated": false,
          "experimental": false
        },
        "support": {
          "android": {
            "version_added": "1.0"
          },
          "ios": {
            "version_added": "1.0"
          },
          "harmony": {
            "version_added": "3.4"
          },
          "clay_android": {
            "version_added": "1.0"
          },
          "clay_ios": {
            "version_added": "1.0"
          },
          "clay_macos": {
            "version_added": "1.0"
          },
          "clay_windows": {
            "version_added": "1.0"
          },
          "web_lynx": {
            "version_added": true
          }
        }
      },
      "box-shadow": {
        "__compat": {
          "status": {
            "deprecated": false,
            "experimental": false
          },
          "support": {
            "android": {
              "notes": "The new animator supports <code>transition-property: box-shadow</code> since Lynx 4.2.",
              "version_added": "4.2"
            },
            "ios": {
              "notes": "The new animator supports <code>transition-property: box-shadow</code> since Lynx 4.2.",
              "version_added": "4.2"
            },
            "harmony": {
              "notes": "The new animator supports <code>transition-property: box-shadow</code> since Lynx 4.2.",
              "version_added": "4.2"
            },
            "clay_android": {
              "version_added": "4.2"
            },
            "clay_ios": {
              "version_added": "4.2"
            },
            "clay_macos": {
              "version_added": "4.2"
            },
            "clay_windows": {
              "version_added": "4.2"
            },
            "web_lynx": {
              "version_added": true
            }
          }
        }
      },
      "border-radius": {
        "__compat": {
          "status": {
            "deprecated": false,
            "experimental": false
          },
          "support": {
            "android": {
              "notes": "The new animator supports <code>border-radius</code> and its four physical corner longhands. <code>px</code> endpoints and percentage endpoints animate component by component; <code>px</code>-to-percentage and mixed <code>calc()</code> endpoints do not transition.",
              "version_added": true
            },
            "ios": {
              "notes": "The new animator supports <code>border-radius</code> and its four physical corner longhands. <code>px</code> endpoints and percentage endpoints animate component by component; <code>px</code>-to-percentage and mixed <code>calc()</code> endpoints do not transition.",
              "version_added": true
            },
            "harmony": {
              "notes": "The new animator supports <code>border-radius</code> and its four physical corner longhands. <code>px</code> endpoints and percentage endpoints animate component by component; <code>px</code>-to-percentage and mixed <code>calc()</code> endpoints do not transition.",
              "version_added": true
            },
            "web_lynx": {
              "version_added": true
            }
          }
        }
      }
    }
  }
}
